{
  "id": "retail.check_stock",
  "name": "check_stock",
  "title": "Check stock",
  "description": "Check real-time availability for one specific, already-identified product by its productId, optionally at a given quantity or delivery postal code. Use this only when you already know which product you want; use search_products or apply_filters first if you don't yet have a productId. Unlike search_products, this never returns other products.",
  "inputSchema": {
    "type": "object",
    "properties": {
      "productId": { "type": "string", "minLength": 1 },
      "quantity": { "type": "integer", "minimum": 1 },
      "postalCode": { "type": "string" }
    },
    "required": ["productId"],
    "additionalProperties": false
  },
  "outputSchema": {
    "type": "object",
    "properties": {
      "productId": { "type": "string" },
      "inStock": { "type": "boolean" },
      "availableQuantity": { "type": "integer", "minimum": 0 },
      "estimatedRestockDate": { "type": "string", "format": "date" }
    },
    "required": ["productId", "inStock"],
    "additionalProperties": false
  },
  "annotations": {
    "readOnlyHint": true,
    "untrustedContentHint": false,
    "requiresConfirmation": false
  },
  "stability": "draft",
  "version": "0.1.0"
}
